{
  "id": "weekly-planner-guide",
  "createdAt": "2026-03-08T00:00:00.000Z",
  "title": "Weekly Planner Guide: The 1-3-5 Method & Free Templates",
  "slug": "weekly-planner-guide",
  "pageUrl": "/blog/weekly-planner-guide/",
  "status": "published",
  "contentType": "cluster",
  "hubId": "planning-cadence",
  "primaryKeyword": "weekly planner",
  "wordCount": 2400,
  "publishDate": "2026-03-08",
  "phase": "phase-1",
  "priority": "medium"
}
