{
  "id": "planner-apps-adhd",
  "createdAt": "2026-03-10T00:00:00.000Z",
  "title": "Best Planner Apps for ADHD: Focus Tools That Actually Work",
  "slug": "planner-apps-adhd",
  "pageUrl": "/blog/planner-apps-adhd/",
  "status": "published",
  "contentType": "standalone",
  "hubId": "niche-audiences",
  "primaryKeyword": "planner apps for adhd",
  "wordCount": 2800,
  "publishDate": "2026-03-10",
  "phase": "phase-1",
  "priority": "high",
  "notes": "Best position (17.73) but 0 CTR. KD 0 on primary keyword — massive opportunity."
}
