{
  "id": "ai-daily-planner",
  "createdAt": "2026-03-28T00:00:00.000Z",
  "title": "AI Daily Planner Apps: Smart Scheduling for 2026",
  "slug": "ai-daily-planner",
  "pageUrl": "/blog/ai-daily-planner/",
  "status": "planned",
  "contentType": "cluster",
  "hubId": "ai-planner",
  "primaryKeyword": "ai daily planner",
  "scheduledDate": "2026-04-10",
  "phase": "phase-2",
  "priority": "high",
  "notes": "Blue ocean opportunity — 'AI planner app' SERP has zero tracked competitors in top 9."
}
