{
  "id": "daily-planner-guide",
  "createdAt": "2026-03-05T00:00:00.000Z",
  "title": "The Ultimate Daily Planner Guide: Systems, Templates & Apps",
  "slug": "daily-planner-guide",
  "pageUrl": "/blog/daily-planner-guide/",
  "status": "published",
  "contentType": "pillar",
  "hubId": "planning-cadence",
  "primaryKeyword": "daily planner",
  "wordCount": 4500,
  "publishDate": "2026-03-05",
  "phase": "phase-1",
  "priority": "high",
  "notes": "Pillar page for Planning Cadence hub. Target SV 22.2K."
}
